company_name,jd,job_tag,job_title,salary,skill_cata_tag,url
Oursky Limited, æ˜¯ä¸€å®¶å‰µç«‹æ–¼é¦™æ¸¯çš„è»Ÿé«”å…¬å¸ï¼Œé™¤äº†åœ¨é¦™æ¸¯ã€å°åŒ—å’Œå€«æ•¦è¨­æœ‰å›ºå®šè¾¦å…¬å®¤ï¼Œæˆ‘å€‘å¤šå…ƒåŒ–çš„åœ˜éšŠæˆå“¡åœ¨ä¸åŒåœ‹å®¶å’Œåœ°é»é ç«¯å·¥ä½œã€‚æˆ‘å€‘ä»¥é–‹ç™¼è€…å’ŒæŠ€è¡“ç‚ºä¸­å¿ƒã€æ¨å´‡è·äººç²¾ç¥ï¼Œä¸¦è‡´åŠ›æ¨å‹•ç¤¾æœƒé€²æ­¥ã€‚æˆ‘å€‘ä»¥é–‹ç™¼é–‹æºè»Ÿé«”è§£æ±ºæ–¹æ¡ˆç‚ºå·±ä»»ï¼Œå”åŠ©ä¼æ¥­é€²è¡Œæ•¸ä½è½‰å‹ï¼Œä»¥åŠå¹«åŠ©é–‹ç™¼è€…æ‰“é€ å®‰å…¨åŠé‡è¦–éš±ç§çš„è»Ÿé«”ã€‚æˆ‘å€‘çš„ç”¢å“å‡æ˜¯è‡ªç±Œç¶“è²»ç ”ç™¼ï¼Œç¢ºä¿ Oursky çš„å·¥ç¨‹å¸«æ–‡åŒ–åŠç´ è³ªèƒ½é«”ç¾åœ¨æ¯å€‹é …ç›®ä¸Šã€‚|||Oursky æœ‰æ¿ƒåšçš„å·¥ç¨‹å¸«æ–‡åŒ–ï¼Œä¾‹å¦‚æˆ‘å€‘å¸¸å¸¸æœƒå˜—è©¦æœ€æ–°çš„ç¨‹å¼èªè¨€ï¼ˆé›–ç„¶æˆ‘å€‘å¤§éƒ¨åˆ†çš„ç¨‹å¼ç¢¼éƒ½æ˜¯ Python æˆ– Goï¼Œä½†ä¹Ÿæœƒç”¨ Haskellã€Rust æˆ–æ¢ç´¢å¯¦é©—å…¶ä»–æ–°èªè¨€ï¼‰ã€ä¿æŒé«˜æ°´æº–çš„ Code Reviewï¼Œä¸¦æ¡ç”¨ç²¾ç°¡æµç¨‹çš„å…§éƒ¨å·¥å…·å¦‚ DevOps åŠ CI ç›¸é—œçš„è»Ÿé«”ã€‚|||äº†è§£æ›´å¤šï¼š|||-|||æˆ‘å€‘æ­£åœ¨æ‹›å‹Ÿè»Ÿé«”å·¥ç¨‹å¸«åŠ å…¥åœ˜éšŠï¼ä½ å°‡æœƒç²å¾—è³‡æ·±å·¥ç¨‹å¸«çš„æŒ‡å°ï¼ŒåŒæ™‚å’Œä¸€ç¾¤é ‚å°–çš„å·¥ç¨‹å¸«ä¸€èµ·å·¥ä½œï¼|||æˆ‘å€‘çš„åœ˜éšŠä¸»è¦ä½¿ç”¨ä»¥ä¸‹çš„æŠ€è¡“ï¼ˆä½ ä¸éœ€è¦æŒæ¡å…¨éƒ¨æŠ€è¡“ï¼Œä½†æˆ‘å€‘æœŸæœ›ä½ èƒ½å¿«é€Ÿå­¸ç¿’å¤§éƒ¨åˆ†æŠ€è¡“ï¼‰ï¼š,è»Ÿé«”å·¥ç¨‹å¸«,Web / Mobile App Developer è»Ÿé«”å·¥ç¨‹å¸«,75.5k - 100.5k TWD Monthly,,https://meet.jobs/zh-TW/jobs/28377-web-mobile-app-developer-%E8%BB%9F%E9%AB%94%E5%B7%A5%E7%A8%8B%E5%B8%AB
éŠæˆ²PHPé–‹ç™¼å·¥ç¨‹å¸«,,è»Ÿé«”å·¥ç¨‹å¸«,GM,80k - 180k TWD Monthly,PHP|||MySQL,https://meet.jobs/zh-TW/jobs/36922-gm-%E9%81%8A%E6%88%B2php%E9%96%8B%E7%99%BC%E5%B7%A5%E7%A8%8B%E5%B8%AB
æµªLIVE,ã€ABOUT ç”¢å“æŠ€è¡“ç ”ç™¼ä¸­å¿ƒã€‘|||æˆ‘å€‘çš„ç”¢å“åŒ…æ‹¬|||ã€ŒæµªLIVEç›´æ’­ã€éŸ³æ¨‚æ‰å¥³ã€ç´ äººå”±å°‡ã€å¯¦åŠ›å¥³åœ˜ï¼Œæœ€å…·å½±éŸ¿åŠ›çš„ç›´æ’­å¹³å°|||ã€ŒPOPOç­†è¨˜ã€åˆ†äº«ä½ çš„ç¾å¥½ç”Ÿæ´»ãƒ»ç©¿æ­ã€ç¾å¦ã€ç¾é£Ÿã€æ—…éŠç¤¾ç¾¤å¹³å°|||ã€ŒPLAYONEã€ç·šä¸ŠéŠæˆ²é™ªç©ï¼Œæ”œæ‰‹å¾æœè™›æ“¬çš„æˆ°å ´|||å …æŒæ‰“é€ ç¶ è‰²ç›´æ’­/ç¤¾ç¾¤å¹³å°ï¼Œæˆç‚ºå…§å®¹å‰µä½œè€…çš„å„ªè³ªå­µåŒ–å™¨ã€‚|||å°ˆå±¬æŠ€è¡“ç ”ç™¼ä¸­å¿ƒåœ˜éšŠï¼Œç²¾å¿ƒæ‰“é€ æœ€å¤šå…ƒçš„APPç”¢å“ç·šï¼Œ 2018å¹´ä¸‹è¼‰é‡çªç ´200è¬ï¼Œ 2020å¹´ä¸‹è¼‰é‡ç ´500è¬!|||ã€ABOUT ä½ çš„ä»»å‹™ç›®æ¨™ã€‘|||ï¼ è¨­è¨ˆæ¨¡çµ„æ¶æ§‹ï¼Œå®ŒæˆåŠŸèƒ½éœ€æ±‚|||ï¼ å„ªåŒ–æ€§èƒ½ã€é‡æ§‹æ—¢æœ‰ç¨‹å¼æ¶æ§‹|||ï¼ èˆ‡PMåŠUIè¨­è¨ˆè¨è«–åŠŸèƒ½é–‹ç™¼æ–¹å¼|||ï¼ æŠ€è¡“æ–‡ä»¶æ’°å¯«èˆ‡ç®¡ç†|||ã€ABOUT æˆ‘å€‘çš„æ¢ä»¶è¦æ±‚ã€‘|||ï¼å…·å‚™5å¹´ä»¥ä¸Šçš„ iOS åŸç”Ÿæ‰‹æ©Ÿ app é–‹ç™¼ç¶“é©—|||ï¼ç†Ÿæ‚‰Objective-Cã€Swiftèªè¨€ï¼Œå…¶ä¸€çš†å¯|||ï¼ç†Ÿæ‚‰UIKitç­‰iOSç³»çµ±framework|||ï¼ç†Ÿæ‚‰gitç‰ˆæœ¬æ§ç®¡å·¥å…·|||ï¼ æš¸è§£iOSä¸Š Multi-threadã€GCD ï¼Œæœ‰å¤§å‹å°ˆæ¡ˆç¶­è­·ã€é‡æ§‹ç¶“é©—ï¼Œç‚ºåŠ åˆ†ç¶“é©—|||ï¼ åƒèˆ‡éç¤¾ç¾¤ã€éŠæˆ²ã€å½±éŸ³ç­‰ç”¢å“é¡å‹ï¼Œç‚ºåŠ åˆ†ç¶“é©—|||ã€ABOUT è·æ¥­è¦åŠƒï¼†è–ªé…¬ã€‘|||ï¼æˆ‘å€‘æœƒä¾æ“šä½ éå¾€çš„ç”¢å“ç¶“é©—ã€æŠ€è¡“ç¶“é©—ä¾†åšçŸ­ä¸­æœŸå·¥ä½œè§’è‰²è¦åŠƒ|||ï¼æ¥è§¸åˆ°çš„APPç”¢å“å…·å‚™è‰¯å¥½çš„å¸‚å ´ç™¼å±•æ€§|||ï¼åƒèˆ‡åˆ°çš„ç”¢å“é¡å‹çµ•å°è±å¯Œä¸å–®ä¸€|||ï¼æ¢ç´¢åˆ°çš„æŠ€è¡“çŸ¥è­˜ä¿æŒåœ¨è¶¨å‹¢çš„å‰ç«¯|||ï¼ Sr.iOS Engineer iOSå·¥ç¨‹å¸«ï¼Œå°‡è¦–å°ˆæ¡ˆè±å¯Œåº¦ï¼Œå¹´åº¦è–ªé…¬ç´„åœ¨120~150è¬|||ï¼å¦‚å€‹äººæŠ€è¡“ç¶“é©—ã€ç”¢å“ç¶“é©—ï¼Œèˆ‡å…¬å¸ç­–ç•¥ç™¼å±•æœ‰é«˜åº¦ç›¸é—œï¼Œè–ªè³‡å¦æœ‰å¯è«‡ç©ºé–“|||ã€ABOUT è¾¦å…¬ç’°å¢ƒã€‘|||ï¼ è¾¦å…¬å®¤åº§è½ä¿¡ç¾©å€ï¼Œé›¢å¸‚æ”¿åºœæ·é‹ç«™æ­¥è¡Œ5åˆ†é˜|||ï¼ é–‹æ”¾å¼è¾¦å…¬ç’°å¢ƒï¼Œå°çµ„è¨è«–ç©ºé–“ã€å’–å•¡å€‹äººä¼‘æ†©å€ã€æ¯äººé…ç½®è‡ªå‹•å‡é™æ¡Œ|||ï¼ è¡¨å®šå·¥ä½œæ™‚é–“ï¼Œæ¯æ—¥10ï¼š00-19:00ï¼Œæœ‰å½ˆæ€§ä¸‹ä¸Šç­è¦åŠƒ|||ï¼ ç¦å§”æœƒè²¼å¿ƒè¦åŠƒä¸‹åˆèŒ¶ã€è¾¦å…¬å®¤å„ªæƒ é›¶é£Ÿè²©å”®ã€å®šæœŸèšé¤..ç­‰ï¼Œéš¨æ™‚è£œå……ç²¾åŠ›è¶Šæˆ°è¶Šå‹‡|||ã€ç­è§£æˆ‘å€‘æ›´å¤š..ã€‘|||linkedinä¼æ¥­é é¢|||https://www.linkedin.com/company/%E6%97%AD%E7%91%9E%E6%96%87%E5%8C%96%E5%82%B3%E5%AA%92-%E6%B5%AAlive/about/?viewAsMember=true|||ä¼æ¥­å‹•æ…‹|||https://www.mirrormedia.mg/premium/20201008bus001/|||https://www.techbang.com/posts/90010-langlive-sponsors-hualien-chong-de-primary-school-football-team|||æµªLIVEãƒ»æµªLIFEãƒ»,è»Ÿé«”å·¥ç¨‹å¸«,Sr. iOS Engineerï¼ˆSeniorï¼†Staff Levelï¼‰,1.1m+ TWD Annually,swift|||objective-C,https://meet.jobs/zh-TW/jobs/39446-sr-ios-engineerseniorstaff-level
Oursky Limited, æ˜¯ä¸€å®¶å‰µç«‹æ–¼é¦™æ¸¯çš„è»Ÿé«”å…¬å¸ï¼Œé™¤äº†åœ¨é¦™æ¸¯ã€å°åŒ—å’Œå€«æ•¦è¨­æœ‰å›ºå®šè¾¦å…¬å®¤ï¼Œæˆ‘å€‘å¤šå…ƒåŒ–çš„åœ˜éšŠæˆå“¡åœ¨ä¸åŒåœ‹å®¶å’Œåœ°é»é ç«¯å·¥ä½œã€‚æˆ‘å€‘ä»¥é–‹ç™¼è€…å’ŒæŠ€è¡“ç‚ºä¸­å¿ƒã€æ¨å´‡è·äººç²¾ç¥ï¼Œä¸¦è‡´åŠ›æ¨å‹•ç¤¾æœƒé€²æ­¥ã€‚æˆ‘å€‘ä»¥é–‹ç™¼é–‹æºè»Ÿé«”è§£æ±ºæ–¹æ¡ˆç‚ºå·±ä»»ï¼Œå”åŠ©ä¼æ¥­é€²è¡Œæ•¸ä½è½‰å‹ï¼Œä»¥åŠå¹«åŠ©é–‹ç™¼è€…æ‰“é€ å®‰å…¨åŠé‡è¦–éš±ç§çš„è»Ÿé«”ã€‚æˆ‘å€‘çš„ç”¢å“å‡æ˜¯è‡ªç±Œç¶“è²»ç ”ç™¼ï¼Œç¢ºä¿ Oursky çš„å·¥ç¨‹å¸«æ–‡åŒ–åŠç´ è³ªèƒ½é«”ç¾åœ¨æ¯å€‹é …ç›®ä¸Šã€‚|||Oursky æœ‰æ¿ƒåšçš„å·¥ç¨‹å¸«æ–‡åŒ–ï¼Œä¾‹å¦‚æˆ‘å€‘å¸¸å¸¸æœƒå˜—è©¦æœ€æ–°çš„ç¨‹å¼èªè¨€ï¼ˆé›–ç„¶æˆ‘å€‘å¤§éƒ¨åˆ†çš„ç¨‹å¼ç¢¼éƒ½æ˜¯ Python æˆ– Goï¼Œä½†ä¹Ÿæœƒç”¨ Haskellã€Rust æˆ–æ¢ç´¢å¯¦é©—å…¶ä»–æ–°èªè¨€ï¼‰ã€ä¿æŒé«˜æ°´æº–çš„ Code Reviewï¼Œä¸¦æ¡ç”¨ç²¾ç°¡æµç¨‹çš„å…§éƒ¨å·¥å…·å¦‚ DevOps åŠ CI ç›¸é—œçš„è»Ÿé«”ã€‚|||äº†è§£æ›´å¤šï¼š|||------|||æˆ‘å€‘æ­£åœ¨æ‹›å‹Ÿè³‡æ·±è»Ÿé«”å·¥ç¨‹å¸«åŠ å…¥æˆ‘å€‘çš„åœ˜éšŠï¼Oursky çš„è³‡æ·±è»Ÿé«”å·¥ç¨‹å¸«éƒ½èƒ½åœ¨ä¸åŒçš„è»Ÿé«”å°ˆæ¡ˆæ¸¸åˆƒæœ‰é¤˜ï¼›ä¸¦è¦–èƒ½åŠ›æ™‰å‡ç‚º Tech Leadï¼Œè² è²¬æŒ‡å°å…¶ä»–åœ˜éšŠæˆå“¡æˆ–æˆç‚ºä½ æ“…é•·é ˜åŸŸè£¡çš„å°ˆæ‰ã€‚|||æˆ‘å€‘çš„åœ˜éšŠä¸»è¦ä½¿ç”¨ä»¥ä¸‹çš„æŠ€è¡“ï¼ˆä½ ä¸éœ€è¦æŒæ¡å…¨éƒ¨æŠ€è¡“ï¼Œä½†æˆ‘å€‘æœŸæœ›ä½ èƒ½å¿«é€Ÿå­¸ç¿’å¤§éƒ¨åˆ†æŠ€è¡“ï¼‰ï¼š|||æˆ‘å€‘çš„åœ˜éšŠåœ¨ä¸åŒåœ°é»é ç«¯å·¥ä½œï¼Œæˆ‘å€‘æ¨‚æ„ç‚ºä½ æä¾›åœ¨ç•°åœ°å·¥ä½œå’Œç”Ÿæ´»çš„æ©Ÿæœƒã€‚ æº–å‚™å¥½å±•é–‹äººç”Ÿæ–°çš„ä¸€é äº†å—ï¼Ÿ æˆ‘å€‘é€éè´ŠåŠ©å·¥ä½œç°½è­‰ç­‰è¡Œå‹•æ”¯æŒé ç«¯å·¥ä½œå’Œå…¨çƒ relocationã€‚æƒ³äº†è§£æ›´å¤šï¼Œä¾†å’Œæˆ‘å€‘èŠèŠå§ï¼|||ç·šä¸Šç”³è«‹ï¼š,è»Ÿé«”å·¥ç¨‹å¸«,Senior Software Engineer è³‡æ·±è»Ÿé«”å·¥ç¨‹å¸«,113k - 138k TWD Monthly,,https://meet.jobs/zh-TW/jobs/28378-senior-software-engineer-%E8%B3%87%E6%B7%B1%E8%BB%9F%E9%AB%94%E5%B7%A5%E7%A8%8B%E5%B8%AB
Tensorcom,"Tensorcom, a pioneer in developing innovative semiconductors for high-speed millimeter wave, ultra-low power, wireless communication chipsets is looking for a candidate who is interested in developing software tools, drivers, and firmware for its highspeed wireless millimeter wave network communications products.|||As an experienced S/W designer, you will be expected to have deep knowledge of and experience in one or more major specialty functions of one or more programming languages, OS device drivers, technical skills and working experience.|||In addition to excellent technical skills, good English communication skills are required.|||The interested candidate will be responsible for:|||Â· Developing application software/tools, drivers, and firmware for Tensorcomâ€™s wireless networking products.|||The interested candidate shall have demonstrable experience in:|||Â· Programming Languages such as:|||o The C/C++ programming language|||o One or more of these programming languages: Python, Java, Perl, TCL, etc., which would be a plus|||Â· Developing device drivers for well-known OSes such as:|||o Windows 10/11|||o Android/Linux|||o macOS/iOS|||Â· These S/W knowledge/skill sets such as:|||o Multi-threaded/processing environments|||o Network OSI model architecture|||o Wireless communication protocols|||Â· These H/W knowledge/skill sets such as:|||o Familiarity with H/W system architectures|||o These interfaces: USB, PCIe, GPIO, JTAG, SPI, UART|||Â· Designing and implementing Application Software for product demonstrations|||Â· Developing diagnostic tools for factory verification plan|||Â· Previous working experience on WLAN SoC, Ethernet NIC, storage SoC are highly desirable.|||â–  BS â–  MS|||Computer Science, Computer Engineering, Electrical Engineering, or similar applicable degrees|||5+ years",è»Ÿé«”å·¥ç¨‹å¸«,"Software Development Engineer, è»Ÿé«”é–‹ç™¼å·¥ç¨‹å¸«(é©…å‹•ç¨‹å¼)",30k - 100k TWD Monthly,,https://meet.jobs/zh-TW/jobs/39447-software-development-engineer-%E8%BB%9F%E9%AB%94%E9%96%8B%E7%99%BC%E5%B7%A5%E7%A8%8B%E5%B8%AB%E9%A9%85%E5%8B%95%E7%A8%8B%E5%BC%8F
Tensorcom,"Tensorcom, a pioneer in developing innovative semiconductors for high-speed millimeter wave, ultra-low power, wireless communication chipsets is looking for a candidate who is interested in developing software tools, drivers, and firmware for its highspeed wireless millimeter wave network communications products.|||As an experienced S/W designer, you will be expected to have deep knowledge of and experience in one or more major specialty functions of one or more programming languages, OS device drivers, technical skills and working experience.|||In addition to excellent technical skills, good English communication skills are required.|||The interested candidate will be responsible for:|||Â· Developing application software/tools, drivers, and firmware for Tensorcomâ€™s wireless networking products.|||The interested candidate shall have demonstrable experience in:|||Â· Programming Languages such as:|||o The C/C++ programming language|||o One or more of these programming languages: Python, Java, Perl, TCL, etc., which would be a plus|||Â· Developing device drivers for well-known OSes such as:|||o Windows 10/11|||o Android/Linux|||o macOS/iOS|||Â· These S/W knowledge/skill sets such as:|||o Multi-threaded/processing environments|||o Network OSI model architecture|||o Wireless communication protocols|||Â· These H/W knowledge/skill sets such as:|||o Familiarity with H/W system architectures|||o These interfaces: USB, PCIe, GPIO, JTAG, SPI, UART|||Â· Designing and implementing Application Software for product demonstrations|||Â· Developing diagnostic tools for factory verification plan|||Â· Previous working experience on WLAN SoC, Ethernet NIC, storage SoC are highly desirable.|||â–  BS â–  MS|||Computer Science, Computer Engineering, Electrical Engineering, or similar applicable degrees|||5+ years",è»Ÿé«”å·¥ç¨‹å¸«,Software Development Engineer,30k - 100k TWD Monthly,,https://meet.jobs/zh-TW/jobs/39453-software-development-engineer
Netskope Taiwan,"Netskope's API Protection Framework team is responsible for designing and implementing a scalable and elastic architecture to provide protection for enterprise SaaS and IaaS application data. This is achieved by ingesting high volume activity events at near real-time and analysing data to provide security risk management for our customers, including data security, access control, threat prevention, data loss prevention, user coaching and more.|||As a member of this team you will work in an innovative, fast-paced environment with other experts to build Cloud-Native solutions using technologies like Kubernetes, Helm, Prometheus, Grafana, Jaeger (open tracing), persistent messaging queues, SQL/NO-SQL databases, key-value stores, etc. You will solve complex scale problems, deploy and manage the solution in production. If you are driven by high-quality, high-velocity software delivery challenges, and using innovative and cutting edge solutions to achieve these goals, we would like to speak with you.",è»Ÿé«”å·¥ç¨‹å¸«,"Staff Software Development Engineer in Test, API Protection Framework",1.8m+ TWD Annually,golang|||python|||automation testing|||automation test frameworks,https://meet.jobs/zh-TW/jobs/39070-staff-software-development-engineer-in-test-api-protection-framework
SWAG,"As a Senior Backend Engineer on the Application team, you will be working closely with the Product and Client teams to implement new features. With needing to support millions of requests per minute,performanceandstabilityare some of the top concerns in your design. You are able to design in increments and be able to prioritise feature requirements and optimizations. You aim for re-usability in the components with a KISS mentality.",è»Ÿé«”å·¥ç¨‹å¸«,Senior Backend Engineer,2m - 2.5m TWD Annually,Python|||NodeJS|||Mongo|||Redis,https://meet.jobs/zh-TW/jobs/37483-senior-backend-engineer
çµ±æ™ºç§‘æŠ€è‚¡ä»½æœ‰é™å…¬å¸,"
åƒèˆ‡å¤§å‹æ™ºæ…§é›¶å”®ã€ç‰©æµç³»çµ±çš„å¾Œç«¯è¨­è¨ˆã€é–‹ç™¼ã€ç¶­è­·å·¥ä½œã€‚|||â˜…è·ç¼ºé–‹å•ŸåŸå› ï¼šé›²ç«¯åœ˜éšŠæŒçºŒæ“´ç·¨ä¸­â˜…|||ã€å¿…è¦æ¢ä»¶ã€‘|||- å°å­¸ç¿’æ–°çŸ¥ä¿æŒç©æ¥µ|||-å…· 3å¹´ä»¥ä¸Šå¾Œç«¯é–‹ç™¼ç¶“é©— - ç†Ÿ C#ã€.NET Core|||- ä½¿ç”¨ Entity Frameworkï¼Dapperï¼å…¶ä»–ç›¸ä¼¼å·¥å…·|||- ä½¿ç”¨ MSTestï¼NUnitï¼xUnit ä»»ä¸€ç¨®å–®å…ƒæ¸¬è©¦æ¡†æ¶|||- ä½¿ç”¨ ç‰ˆæ§ï¼ˆGit å„ªå…ˆï¼‰|||- æŒçºŒé‡æ§‹ç¨‹å¼ç¢¼çš„ç¿’æ…£ï¼ˆClean Codeï¼‰|||ã€åŠ åˆ†æ¢ä»¶é¸é …ã€‘|||- ä¸²æ¥ AWSã€Azureã€GCP é–‹ç™¼ç¶“é©— ï¼ˆå…¬å¸æ¬²æ¨è¡Œã€Œé›²ç«¯æœå‹™å¹³å°ã€çš„æ•™è‚²è¨“ç·´ï¼‰|||- ç³»çµ±æ¶æ§‹ã€ç¨‹å¼æ¶æ§‹è¨­è¨ˆç¶“é©—ï¼å¾®æœå‹™é–‹ç™¼ç¶“é©—|||- Store Procedure çš„é–‹ç™¼ã€ç¶­è­·ç¶“é©—",è»Ÿé«”å·¥ç¨‹å¸«,ã€é è·é¢è©¦å„ªå…ˆã€‘C#å¾Œç«¯é–‹ç™¼å·¥ç¨‹å¸«,680k - 1.2m TWD Annually,c#.net|||asp.net,https://meet.jobs/zh-TW/jobs/29185-%E9%81%A0%E8%B7%9D%E9%9D%A2%E8%A9%A6%E5%84%AA%E5%85%88c%E5%BE%8C%E7%AB%AF%E9%96%8B%E7%99%BC%E5%B7%A5%E7%A8%8B%E5%B8%AB
ä»¥æ©è³‡è¨Š,"å·¥ä½œå…§å®¹ï¼š|||1. æ•¸ç†é‚è¼¯èƒ½åŠ›å¼·ï¼Œä¸”è³‡è¨Šç›¸é—œç§‘ç³»ç•¢æ¥­æˆ–3å¹´ä»¥ä¸Šç¨‹å¼é–‹ç™¼ç¶“é©—ã€‚|||2. ç†Ÿæ‚‰C++, C#åŠJava(éœ€æœ‰å¯¦å‹™ç¶“é©—)ã€‚|||3. å°ç¨‹å¼è¨­è¨ˆæœ‰é«˜åº¦ç†±æ•ï¼Œå¯å¿«é€Ÿé©æ‡‰ä¸åŒé–‹ç™¼ç’°å¢ƒï¼Œç†Ÿæ‚‰å¤§å‹è»Ÿé«”é–‹ç™¼æµç¨‹è€…å°¤ä½³ã€‚|||4. å…·å‚™å‰µé€ æ€§æ€è€ƒèƒ½åŠ›ï¼Œèƒ½å–„ç”¨ç¶²è·¯è§£æ±ºå•é¡Œã€‚|||5. é«˜é…åˆåº¦ï¼Œé©æ‡‰åœ˜éšŠåˆä½œä¸”æŠ—å£“æ€§å¼·ï¼Œå…·æœ‰è‰¯å¥½çš„æºé€šå”èª¿èƒ½åŠ›ã€‚",è»Ÿé«”å·¥ç¨‹å¸«,"Senior Product Development Engineer | è³‡æ·±ç”¢å“ç ”ç™¼å·¥ç¨‹å¸« (C++, C#, Java,)",110k+ TWD Monthly,C++|||C#|||JAVA|||è»Ÿé«”é–‹ç™¼,https://meet.jobs/zh-TW/jobs/36928-senior-product-development-engineer-%E8%B3%87%E6%B7%B1%E7%94%A2%E5%93%81%E7%A0%94%E7%99%BC%E5%B7%A5%E7%A8%8B%E5%B8%AB-c-c-java
ä»¥æ©è³‡è¨Š,"å·¥ä½œå…§å®¹ï¼š|||1. è³‡è¨Šç›¸é—œç§‘ç³»å¤§å°ˆä»¥ä¸Šç•¢æ¥­, 2å¹´ä»¥ä¸Šå·¥ä½œç¶“é©—|||2. ç†ŸJava, JSP, Java Script, AJAX, HTML ç­‰ç›¸é—œç¶²é æŠ€è¡“|||3. ç†Ÿæ‚‰è³‡æ–™åº«èˆ‡ç›¸é—œé–‹ç™¼å·¥å…·, ç†ŸMS-SQLï¼ˆOracleã€Mysql äº¦ç†Ÿæ‚‰è€…å°¤ä½³ï¼‰|||4. èˆ‡å°ˆæ¡ˆç¶“ç†ã€å®¢æœäººå“¡ç­‰ç›¸é—œäººå“¡é…åˆï¼Œå”åŒåŸ·è¡Œå°ˆæ¡ˆ|||5. ä¸»å‹•ï¼Œè² è²¬ï¼Œç†±èª |||6. è‡³å°‘äºŒå¹´ä»¥ä¸Šç¶²é æ‡‰ç”¨ç¨‹å¼é–‹ç™¼ç¶“é©—",è»Ÿé«”å·¥ç¨‹å¸«,Product Support S/W Engineer | è»Ÿé«”ç”¢å“æ”¯æ´å·¥ç¨‹å¸«,60k+ TWD Monthly,JAVA|||JSP|||JAVA SCRIPT|||AJAX|||HTML|||MS-SQL|||Oracle|||Mysql|||ç¶²é é–‹ç™¼,https://meet.jobs/zh-TW/jobs/36930-product-support-sw-engineer-%E8%BB%9F%E9%AB%94%E7%94%A2%E5%93%81%E6%94%AF%E6%8F%B4%E5%B7%A5%E7%A8%8B%E5%B8%AB
ä»¥æ©è³‡è¨Š,å·¥ä½œå…§å®¹ï¼š|||1. ç†Ÿæ‚‰Java(éœ€æœ‰å¯¦å‹™ç¶“é©—)ã€‚|||2. æ•¸ç†é‚è¼¯èƒ½åŠ›å¼·ï¼Œä¸”è³‡è¨Šç›¸é—œç§‘ç³»ç•¢æ¥­æˆ–3å¹´ä»¥ä¸Šç¨‹å¼é–‹ç™¼ç¶“é©—ã€‚|||3. è£½é€ æ¥­ç”¢ç·šç›¸é—œç³»çµ±é–‹ç™¼ã€ERPã€APIã€è³‡æ–™åº«ç›¸é—œç¶“é©—ç‚ºä½³ã€‚|||4. å°ç¨‹å¼è¨­è¨ˆæœ‰é«˜åº¦ç†±æ•ï¼Œå¯å¿«é€Ÿé©æ‡‰ä¸åŒé–‹ç™¼ç’°å¢ƒï¼Œç†Ÿæ‚‰å¤§å‹è»Ÿé«”é–‹ç™¼æµç¨‹è€…å°¤ä½³ã€‚|||5. å…·å‚™å‰µé€ æ€§æ€è€ƒèƒ½åŠ›ï¼Œèƒ½å–„ç”¨ç¶²è·¯è§£æ±ºå•é¡Œã€‚|||6. é«˜é…åˆåº¦ï¼Œé©æ‡‰åœ˜éšŠåˆä½œä¸”æŠ—å£“æ€§å¼·ï¼Œå…·æœ‰è‰¯å¥½çš„æºé€šå”èª¿èƒ½åŠ›ã€‚,è»Ÿé«”å·¥ç¨‹å¸«,Senior Product Development Engineer | è³‡æ·±ç”¢å“ç ”ç™¼å·¥ç¨‹å¸« (Java),70k+ TWD Monthly,JAVA|||è»Ÿé«”é–‹ç™¼,https://meet.jobs/zh-TW/jobs/36929-senior-product-development-engineer-%E8%B3%87%E6%B7%B1%E7%94%A2%E5%93%81%E7%A0%94%E7%99%BC%E5%B7%A5%E7%A8%8B%E5%B8%AB-java
ATGENOMIX INC.,"Atgenomix aspires to be a company that derives value-based healthcare outcomes for people that our technologies serve. We believe that a talented team of diversified experiences, innovative and trustworthy culture, and dare-to-dream spirit creates the best products and services.|||Atgenomix software engineering team develops the next-generation computing technologies that change how healthcare systems provide patient-centric and value-based personalized medicine. Our products and services need to handle massive scale of genomic information, and extend well beyond bioinformatics.|||Atgenomix is looking for software engineers who are passionate to create innovative technologies in parallel computing, cloud-scale system design, data hub architecture, machine learning, bioinformatics analytics, large database search, user-centric interface design and more. As a software engineer. We need our engineers to be flexible and versatile, display leadership qualities and be enthusiastic to take on new problems across the full-stack as we continue to push technology forward. You will grow with the company and advance your career as Atgenomix business scales and grows.",è»Ÿé«”å·¥ç¨‹å¸«,"Software Engineer, SeqsLab Cloud Platform",1.2m+ TWD Annually,Microsoft Azure|||machine learning|||data structure / algorithm|||REST APIs|||distributed system|||deep learning|||Git|||Linux|||Python|||Scala|||Apache Spark|||Rust|||bioinformatics|||delta lake,https://meet.jobs/zh-TW/jobs/26244-software-engineer-seqslab-cloud-platform
ATGENOMIX INC.,æ‚¨æ¸´æœ›èˆ‡ä¸€ç¾¤è»Ÿé«”ç ”ç™¼é«˜æ‰‹å…±åŒæ‰“é€ ä¸–ç•Œç´šçš„é›²ç«¯åŸç”Ÿç”Ÿé†«å¤§æ•¸æ“šåˆ†æé‹ç®—å¼•æ“ï¼Œæ‚¨æ¸´æœ›å°‡è‡ªå·±ä¸€èº«æ‰€å­¸ç¨‹å¼æŠ€è¡“é‹ç”¨åœ¨æ”¹å–„å€‹äººã€å®¶äººã€æœ‹å‹æœªä¾†çš„å¥åº·é†«ç™‚å—ï¼Ÿ|||åŠ å…¥äºå¤§åŸºå› ç§‘æŠ€è»Ÿé«”ç ”ç™¼åœ˜éšŠï¼Œåšè·Ÿé ‚å°–è»Ÿé«”å…¬å¸ï¼ˆåƒMicrosoftã€Googleã€Amazonï¼‰åŒç­‰ç´šçš„è»Ÿé«”ç ”ç™¼å·¥ä½œï¼Œåœ¨é€™è£¡æ‚¨å°‡å­¸åˆ°ä¸¦é‹ç”¨ç™¼æ®é«˜ç«¯ç¨‹å¼æŠ€è¡“ Apache Spark programmingã€Actor system programmingã€functional programmingã€ML programmingç­‰ç­‰ã€‚,è»Ÿé«”å·¥ç¨‹å¸«,è»Ÿé«”ç ”ç™¼å·¥ç¨‹å¸«,1.2m+ TWD Annually,scala|||java|||linux|||apache spark|||apache akka,https://meet.jobs/zh-TW/jobs/34458-%E8%BB%9F%E9%AB%94%E7%A0%94%E7%99%BC%E5%B7%A5%E7%A8%8B%E5%B8%AB
